{
  "$schema": "http://json-schema.org/draft-07/schema#",
  "title": "chinese-stele-shiwen data format",
  "description": "碑帖释文数据格式 — 每碑一行 JSON 文件",
  "type": "object",
  "required": ["name", "dynasty", "author", "year", "source", "calligraphy_type", "content"],
  "properties": {
    "name": {
      "type": "string",
      "description": "碑帖名称，如《多宝塔碑》"
    },
    "dynasty": {
      "type": "string",
      "enum": ["秦漢", "魏晉南北朝", "隋唐五代", "宋遼金", "元明清", "近現代"],
      "description": "所属朝代枚举"
    },
    "author": {
      "type": "string",
      "description": "书丹者或撰文者姓名"
    },
    "year": {
      "type": "integer",
      "description": "刊立年份（公元纪年），未知则填 -1"
    },
    "calligraphy_type": {
      "type": "string",
      "enum": ["篆書", "隶書", "楷書", "行書", "草書", "其他"],
      "description": "书体"
    },
    "source": {
      "type": "string",
      "description": "释文依据的出版物文献"
    },
    "source_isbn": {
      "type": "string",
      "description": "出版物 ISBN（可选）"
    },
    "editor": {
      "type": "string",
      "description": "数据整理者 ID，用于追溯贡献者"
    },
    "release_date": {
      "type": "string",
      "format": "date",
      "description": "数据录入日期 YYYY-MM-DD"
    },
    "description": {
      "type": "string",
      "description": "碑帖简介（1-3 句）"
    },
    "content": {
      "type": "string",
      "description": "通行释文纯文本，横排简体，按碑文阅读顺序"
    },
    "original_text": {
      "type": "string",
      "description": "碑文原文（含通假字、异体字、残泐标记）"
    },
    "translation": {
      "type": "string",
      "description": "白话译文或通释"
    },
    "note": {
      "type": "string",
      "description": "备注（残损情况、书体特征、鉴藏信息等）"
    },
    "baike_query": {
      "type": "string",
      "description": "检索百科时的参考关键词"
    },
    "raw_type": {
      "type": "string",
      "description": "原始数据类型（碑刻/墓志/墨迹/金文等）"
    },
    "raw_dynasty": {
      "type": "string",
      "description": "原始朝代描述字符串（未映射前的值）"
    },
    "raw_date": {
      "type": "string",
      "description": "原始年代描述字符串"
    },
    "marvis_id": {
      "type": "integer",
      "description": "Marvis 数据集中的原始 ID"
    }
  },
  "additionalProperties": false
}
