{
  "name": "谪龙说卷",
  "dynasty": "元明清",
  "author": "康里巎巎",
  "year": -1,
  "calligraphy_type": "其他",
  "source": "Marvis per_stele 数据集 (id=313)",
  "editor": "marvis-import-v2",
  "release_date": "2024-12-01",
  "description": "类型：墨迹（长卷）。原始朝代：元。作者：康里巎巎。康里巎巎（1295-1345），字子山，号正斋，色目康里部人。元代最杰出的少数民族书法家，与赵孟頫、鲜于枢鼎足而三。其草书直追王羲之、王献之，用笔爽利峻快，一日可写三万字。《谪龙说》是其草书代表作，现藏故宫博物院，书录柳宗元寓言赠友人叶彦中，展现了「一日三万字」的惊人速度与卓越草法。",
  "content": "柳宗元寓言，记扶风马姓少年所述：一神女谪降泽州，预告七日当复为龙，少年等不敢狎近；期满女饮杯水化云气，反裘化为白龙，徊翔登天。文末叹「非其类而狎其谪不可哉」，意为不可与遭贬谪流落之人狎昵相交。康里巎巎以草书录此文赠友人叶彦中。",
  "original_text": "谪龙说，柳子厚。扶风马孺子言：年十四五时，在泽州与群儿戏郊亭上。有光烨然，须臾有奇女坠地，被緅裘白文之里，首步摇之冠。贵游年少悦之，稍狎焉。女頩尔怒曰：「不可！吾固居钧天帝宫，上下星辰，羞昆仑，薄蓬莱，而不即者。帝以吾心侈大，怒而谪来，七日当复。今吾虽困辱尘土中，非若俪也，吾复且害若。」众惧而退。乃入居佛寺讲室焉。及期，进取杯水，嘘成云气，五色翛翛也。乃取其裘反之，化为白龙，徊翔登天，莫知其所如往，亦怪甚矣。呜呼！非其类而狎其谪不可哉。孺子不妄人，故记其说。彦中判府贤友，久不覩仆恶札，因草书《谪龙说》往。想展览之际，如相见也。康里巎再拜。",
  "translation": "柳宗元寓言，记扶风马姓少年所述：一神女谪降泽州，预告七日当复为龙，少年等不敢狎近；期满女饮杯水化云气，反裘化为白龙，徊翔登天。文末叹「非其类而狎其谪不可哉」，意为不可与遭贬谪流落之人狎昵相交。康里巎巎以草书录此文赠友人叶彦中。",
  "note": "康里巎巎（1295-1345），字子山，号正斋，色目康里部人。元代最杰出的少数民族书法家，与赵孟頫、鲜于枢鼎足而三。其草书直追王羲之、王献之，用笔爽利峻快，一日可写三万字。《谪龙说》是其草书代表作，现藏故宫博物院，书录柳宗元寓言赠友人叶彦中，展现了「一日三万字」的惊人速度与卓越草法。",
  "raw_type": "墨迹（长卷）",
  "raw_dynasty": "元",
  "marvis_id": 313
}
