{
  "name": "临集王圣教序",
  "dynasty": "元明清",
  "author": "董其昌",
  "year": -1,
  "calligraphy_type": "其他",
  "source": "Marvis per_stele 数据集 (id=338)",
  "editor": "marvis-import-v2",
  "release_date": "2024-12-01",
  "description": "类型：墨迹（临本）。原始朝代：明。作者：董其昌。董其昌一生对《圣教序》用功最勤，临写无数遍。他通过对《圣教序》的反复临摹，深刻地把握了王羲之行书的神韵。董其昌的临摹不是亦步亦趋，而是\"以己意会古意\"，临出了自己的笔墨语言。",
  "content": "董其昌临《大唐三藏圣教序》（集王羲之行书）。董氏一生心追手摹，此临本可见其学王功力。",
  "original_text": "（董其昌临《集王圣教序》，此为临本而非原文。原碑释文见唐代相关条目。）",
  "translation": "董其昌临《大唐三藏圣教序》（集王羲之行书）。董氏一生心追手摹，此临本可见其学王功力。",
  "note": "董其昌一生对《圣教序》用功最勤，临写无数遍。他通过对《圣教序》的反复临摹，深刻地把握了王羲之行书的神韵。董其昌的临摹不是亦步亦趋，而是\"以己意会古意\"，临出了自己的笔墨语言。",
  "raw_type": "墨迹（临本）",
  "raw_dynasty": "明",
  "marvis_id": 338
}
