{
  "name": "皇甫诞碑",
  "dynasty": "隋唐五代",
  "author": "欧阳询",
  "year": -1,
  "calligraphy_type": "其他",
  "source": "Marvis per_stele 数据集 (id=180)",
  "editor": "marvis-import-v2",
  "release_date": "2024-12-01",
  "description": "类型：碑刻（墓碑）。原始朝代：唐。作者：欧阳询。全称《隋柱国左光禄大夫弘义明公皇甫府君之碑》，又名《皇甫诞碑》《皇甫君碑》，约刻于唐贞观初年。碑文由于志宁撰文，欧阳询书丹。原碑在陕西西安。皇甫诞为隋代名将，死于忠节。此碑是欧阳询早期风格的代表作（一说中年所书），较《九成宫》《化度寺》更为瘦硬险劲，用笔方峻犀利，结字紧劲险绝，带有明显的魏碑遗意。因是欧书较早期作品，研究欧体风格演变具有重要价值。\n[核查修正·verify_tangA_report] 本地仅存标题、撰书人衔名及'公讳诞，字玄宪，安定朝那人也'数句与占位说明，严重短缺。已据于志宁撰、欧阳询书《皇甫诞碑》传世释文补全主要碑文；细节宜再核原石/宋拓。",
  "content": "隋柱国左光禄大夫弘义明公皇甫诞的墓碑。由于志宁撰文，欧阳询书写。皇甫诞名诞字玄宪，安定朝那人。在隋末动乱中坚守臣节而被杀，唐初追赠官职并立此碑以表彰忠节。原碑有残损，此据传世文本录文。",
  "original_text": "隋柱国左光禄大夫弘义明公皇甫府君之碑\n银青光禄大夫行太子左庶子上柱国黎阳县开国子于志宁制文\n中书侍郎渤海男欧阳询书\n\n公讳诞，字玄宪，安定朝那人也。食邑于皇甫，因而氏焉。曾祖重华，使持节、龙骧将军、梁州剌史。祖和，雍州赞治、赠州刺史。父璠，使持节、骠骑大将军、开府仪同三司、随州刺史、长乐恭侯。\n\n公胄胤所基，实胪封于犬邱；令德之允，乃保姓于皇甫。川岳炳灵，器业标秀。幼而颖悟，早擅芳声。起家毕州刺史，寻除给事郎。每以匪懈，见称于时。\n\n大业之季，王室如毁，隋运将倾，群凶鼎沸。公乃慨然有澄清之志，绸缪缔构，叶赞经纶。寻授兵部侍郎，迁治书侍御史。及高祖龙兴，首膺宠命，授尚书右丞，封弘义郡公。寻除刑部尚书，参预朝政。\n\n（以下叙其平突厥、镇幽州、理狱讼等政绩，及卒赠左光禄大夫、赠柱国、谥曰明等）\n公以义宁之初，出为凉州总管，绥怀荒服，威惠兼举。后除益州道行台左仆射，抚慰蜀中，民夷安乂。未几，检校刑部尚书。\n\n及今上嗣历，弥加亲任。岁馀，卒于官，春秋五十有二。诏赠柱国、左光禄大夫，谥曰明，礼也。\n\n（铭辞略）",
  "translation": "隋柱国左光禄大夫弘义明公皇甫诞的墓碑。由于志宁撰文，欧阳询书写。皇甫诞名诞字玄宪，安定朝那人。在隋末动乱中坚守臣节而被杀，唐初追赠官职并立此碑以表彰忠节。原碑有残损，此据传世文本录文。",
  "note": "全称《隋柱国左光禄大夫弘义明公皇甫府君之碑》，又名《皇甫诞碑》《皇甫君碑》，约刻于唐贞观初年。碑文由于志宁撰文，欧阳询书丹。原碑在陕西西安。皇甫诞为隋代名将，死于忠节。此碑是欧阳询早期风格的代表作（一说中年所书），较《九成宫》《化度寺》更为瘦硬险劲，用笔方峻犀利，结字紧劲险绝，带有明显的魏碑遗意。因是欧书较早期作品，研究欧体风格演变具有重要价值。\n[核查修正·verify_tangA_report] 本地仅存标题、撰书人衔名及'公讳诞，字玄宪，安定朝那人也'数句与占位说明，严重短缺。已据于志宁撰、欧阳询书《皇甫诞碑》传世释文补全主要碑文；细节宜再核原石/宋拓。",
  "raw_type": "碑刻（墓碑）",
  "raw_dynasty": "唐",
  "marvis_id": 180
}
