{
  "name": "朝侯小子残碑",
  "dynasty": "秦漢",
  "author": "佚名",
  "year": -1,
  "calligraphy_type": "隶書",
  "source": "Marvis 碑帖释文数据集（第 4 批）；参考：朝侯小子残碑",
  "editor": "marvis-import",
  "release_date": "2024-12-01",
  "description": "类型：碑刻（残）。年代：东汉（无确切纪年）。又名《小子残碑》，1911年出土于陕西长安，现藏北京故宫博物院。碑阳存14行共198字。因首行残存朝侯之小子也而得名。书法精工秀美，与《曹全碑》相近，罗振玉赞为如精金良玉无纤毫浮涨。",
  "content": "这位朝侯的子孙，品行纯正，学问兼有子游子夏之长，勤劳体国，俭朴而有法度。他作为一方学术大师，清晨即被抱持，为孩童和青年们讲学，远近称赞。赠送礼金超过五百万，他都一概不受。即使是古代以孝闻名的二连或孟献，也不能超过他的操守。郡府请其担任主簿、督邮、五官掾。不因好恶废弃功过，不因嫌憎掩盖善行。休假回家保持谦逊。后任郎中、拜谒者，以才能声名被光禄勋举荐。讨伐奸雄，铲除害虫贼寇，以德化消弭兵祸，恬淡无为。安葬含忧，憔悴精神受损，临终形销气尽就此毁灭。英才惋惜，都说他死而不朽，应列入祀典。立碑记述其真实品行。\n挽辞：拒受丧礼志节高远如凌云；孝行感动天地哀恸上达苍天；气血凝结就此陨灭其身。",
  "original_text": "朝侯之小子也，履参，学兼游夏，服勤体□，俭而度。一介学中大主，晨以被抱，为童冠讲，远近称僚。赠送礼赙五百万以上，君皆不受竭不见。虽二连居丧，孟献加等，无以逾焉。行以君为首郡，请署主簿、督邮、五官掾。否好不废过，憎知其善，每休归，在家匿廉。除郎中、拜谒者，以能名为光禄所上。讨奸雄，除其蟊贼，曜德戢兵，泊然无为。卜葬含忧，憔顇精伤，神越终殁之日声，形销气尽，遂以毁灭。英彦惜痛，老小死而不朽，当在祀典者矣。故表斯碑以著之真。辞赙：距赗高志，凌云烝烝；其孝顽凶，哀动穹旻；脉并气结，以陨厥身。",
  "translation": "这位朝侯的子孙，品行纯正，学问兼有子游子夏之长，勤劳体国，俭朴而有法度。他作为一方学术大师，清晨即被抱持，为孩童和青年们讲学，远近称赞。赠送礼金超过五百万，他都一概不受。即使是古代以孝闻名的二连或孟献，也不能超过他的操守。郡府请其担任主簿、督邮、五官掾。不因好恶废弃功过，不因嫌憎掩盖善行。休假回家保持谦逊。后任郎中、拜谒者，以才能声名被光禄勋举荐。讨伐奸雄，铲除害虫贼寇，以德化消弭兵祸，恬淡无为。安葬含忧，憔悴精神受损，临终形销气尽就此毁灭。英才惋惜，都说他死而不朽，应列入祀典。立碑记述其真实品行。\n挽辞：拒受丧礼志节高远如凌云；孝行感动天地哀恸上达苍天；气血凝结就此陨灭其身。",
  "note": "又名《小子残碑》，1911年出土于陕西长安，现藏北京故宫博物院。碑阳存14行共198字。因首行残存朝侯之小子也而得名。书法精工秀美，与《曹全碑》相近，罗振玉赞为如精金良玉无纤毫浮涨。",
  "baike_query": "朝侯小子残碑",
  "raw_type": "碑刻（残）",
  "raw_date": "东汉（无确切纪年）"
}
