{
  "name": "贺铸帖",
  "dynasty": "宋遼金",
  "author": "米芾",
  "year": -1,
  "calligraphy_type": "行書",
  "source": "Marvis 碑帖释文数据集（第 48 批）",
  "editor": "marvis-import",
  "release_date": "2024-12-01",
  "description": "类型：墨迹（尺牍）。年代：宋。翰牍九帖之五。米芾与贺铸交谊深厚，此帖见二人日常交往。",
  "content": "此帖为米芾致词人贺铸的信札。信中表达对友人的思念，并言自己年老不喜笔格（玉笔架），但他人所宝各有所好，待水清时再议。文字简淡而有深意，见二人交谊。",
  "original_text": "（翰牍九帖之五，致贺铸。贺铸，字方回，北宋著名词人。）\n\n芾再启。贺铸能道\n行乐慰人意。玉笔格\n十袭收秘，何如两足\n其好。人生几何，各阏\n其欲。即有意，一介的可\n委者。同去人付子敬\n二帖来授，玉格却付\n一轴去，足示俗目。贺\n见此中本乃云公所收\n纸黑，显伪者。此理如何，\n一决无惑。芾再拜。",
  "translation": "此帖为米芾致词人贺铸的信札。信中表达对友人的思念，并言自己年老不喜笔格（玉笔架），但他人所宝各有所好，待水清时再议。文字简淡而有深意，见二人交谊。",
  "note": "翰牍九帖之五。米芾与贺铸交谊深厚，此帖见二人日常交往。",
  "baike_query": "",
  "raw_type": "墨迹（尺牍）",
  "raw_date": "宋"
}
