{
  "name": "鸭头丸帖",
  "dynasty": "魏晉南北朝",
  "author": "王献之",
  "year": -1,
  "calligraphy_type": "草書",
  "source": "Marvis 碑帖释文数据集（第 11 批）",
  "editor": "marvis-import",
  "release_date": "2024-12-01",
  "description": "类型：行草尺牍（唐摹本）。年代：东晋。行草书，唐摹本，绢本，纵26.1cm横26.9cm，2行15字，现藏上海博物馆。'鸭头丸'是一种利尿消肿的药丸（唐王焘《外台秘要》、明李时珍《本草纲目》均有记载）。从此帖语气看，当是有人已服用过鸭头丸但效果不好告知王献之，王献之服用后觉得果然如此，回信约朋友明日聚会讨论。幅内有北宋徽宗'政和''宣和'印及双龙小印，有虞集、柯九思等跋。此帖为王献之独创'稿行之草'的行草代表作，用墨枯润有致，节奏起伏气韵自然。历代刻帖多有收录。",
  "content": "鸭头丸这种药，果然效果不好。明天一定集会，我会和您见面详谈。",
  "original_text": "鸭头丸，故不佳。明当必集，当与君相见。",
  "translation": "鸭头丸这种药，果然效果不好。明天一定集会，我会和您见面详谈。",
  "note": "行草书，唐摹本，绢本，纵26.1cm横26.9cm，2行15字，现藏上海博物馆。'鸭头丸'是一种利尿消肿的药丸（唐王焘《外台秘要》、明李时珍《本草纲目》均有记载）。从此帖语气看，当是有人已服用过鸭头丸但效果不好告知王献之，王献之服用后觉得果然如此，回信约朋友明日聚会讨论。幅内有北宋徽宗'政和''宣和'印及双龙小印，有虞集、柯九思等跋。此帖为王献之独创'稿行之草'的行草代表作，用墨枯润有致，节奏起伏气韵自然。历代刻帖多有收录。",
  "baike_query": "",
  "raw_type": "行草尺牍（唐摹本）",
  "raw_date": "东晋"
}
