{
  "name": "六分半书",
  "dynasty": "元明清",
  "author": "郑板桥",
  "year": -1,
  "calligraphy_type": "其他",
  "source": "Marvis per_stele 数据集 (id=379)",
  "editor": "marvis-import-v2",
  "release_date": "2024-12-01",
  "description": "类型：墨迹。原始朝代：清。作者：郑板桥。郑板桥（1693-1765），名燮，号板桥。\"扬州八怪\"中最负盛名的人物，诗书画\"三绝\"。郑板桥自创\"六分半书\"——在隶书基础上，融入楷、行、草、篆各体，甚至还吸收了画兰竹的画法。字体忽大忽小、忽正忽斜，看似杂乱却别有奇趣。郑板桥说自己是\"乱石铺街\"的章法。这种打破书体界限的做法，是清代书法个性解放的典型。",
  "content": "（郑板桥以独创的\"六分半书\"写的作品。）",
  "original_text": "（郑板桥\"六分半书\"。郑板桥自创\"六分半书\"——以隶书为底，杂糅楷、行、草、篆各体，还吸收画兰竹的笔法。\"六分半\"意为比八分书（隶书）少一分半。此处录其大略。）",
  "translation": "（郑板桥以独创的\"六分半书\"写的作品。）",
  "note": "郑板桥（1693-1765），名燮，号板桥。\"扬州八怪\"中最负盛名的人物，诗书画\"三绝\"。郑板桥自创\"六分半书\"——在隶书基础上，融入楷、行、草、篆各体，甚至还吸收了画兰竹的画法。字体忽大忽小、忽正忽斜，看似杂乱却别有奇趣。郑板桥说自己是\"乱石铺街\"的章法。这种打破书体界限的做法，是清代书法个性解放的典型。",
  "raw_type": "墨迹",
  "raw_dynasty": "清",
  "marvis_id": 379
}
