{
  "name": "值雨帖",
  "dynasty": "宋遼金",
  "author": "米芾",
  "year": -1,
  "calligraphy_type": "其他",
  "source": "Marvis per_stele 数据集 (id=391)",
  "editor": "marvis-import-v2",
  "release_date": "2024-12-01",
  "description": "类型：墨迹（尺牍）。原始朝代：北宋。作者：米芾。米芾行书尺牍。风雨中的匆匆短信，笔意率真。",
  "content": "米芾叩首。今早拜访恰逢下雨，匆忙写几句。不知书画装裱方案是否合适？如需更换请告知，现先派人送回。米芾惶恐叩首。致伯充防御使台鉴。您庭院的石头怎么处理呢？我此次停留不过数日。",
  "original_text": "芾顿首。早拜见。值雨。草草。不知轴议何者为如法。可换更告批及。今且驰纳。芾皇恐顿首。伯充防御台坐。庭下石如何去里。去住不过数日也。",
  "translation": "米芾叩首。今早拜访恰逢下雨，匆忙写几句。不知书画装裱方案是否合适？如需更换请告知，现先派人送回。米芾惶恐叩首。致伯充防御使台鉴。您庭院的石头怎么处理呢？我此次停留不过数日。",
  "note": "米芾行书尺牍。风雨中的匆匆短信，笔意率真。",
  "raw_type": "墨迹（尺牍）",
  "raw_dynasty": "北宋",
  "marvis_id": 391
}
