{
  "name": "武威汉简",
  "dynasty": "秦漢",
  "author": "佚名",
  "year": -1,
  "calligraphy_type": "隶書",
  "source": "Marvis 碑帖释文数据集（第 6 批）；参考：武威汉简",
  "editor": "marvis-import",
  "release_date": "2024-12-01",
  "description": "类型：简牍。年代：西汉（约西汉晚期）。1959年甘肃武威磨咀子汉墓出土，共约480枚。最重要的内容是九篇《仪礼》，分甲、乙、丙三种抄本，是现存最早的《仪礼》写本。甲本为木简字大简宽，存《士相见》《服传》《特牲》《少牢》《有司》《燕礼》《泰射》七篇；乙本木简字小，仅存《服传》；丙本竹简，仅存《丧服》。此外还有王杖诏书令、日忌杂占等。字体为成熟汉隶，被称为“武威汉隶”。藏于甘肃省博物馆。",
  "content": "【《仪礼·士相见礼》译文】\n士与士相见的礼仪。见面礼物，冬天用野鸡，夏天用风干的野鸡肉。左手捧着礼物，说：“某人愿意拜见，但没有门路通达。某人根据您的指示命我来见您。”主人回答说：“某人根据您的指示命您来见，又劳您亲自前来。请先回家，我当急往拜见。”宾客回答说：“不值得让您如此费心，请务必赐见。”主人回答说：“我不敢讲究虚礼，请先回家，我当急往拜见。”宾客回答说：“我不敢讲究虚礼，坚持请求。”主人回答说：“我坚辞未获允许，将急往拜见。听说您带来了礼物，我怎敢接受礼物。”宾客回答说：“我不带礼物，不敢来见。”主人回答说：“我不值得您如此习礼，斗胆坚辞。”宾客回答说：“我不凭借礼物，不敢来见，坚持请求。”主人回答说：“我坚辞不获允许，怎敢不从命！”出门迎接，再拜。宾客答拜。主人作揖，入门右。宾客捧着礼物，入门左。主人拜受礼物，宾客拜送礼物，出去。",
  "original_text": "武威汉简是1959年甘肃武威磨咀子汉墓出土的简牍，最重要内容是九篇《仪礼》，分甲、乙、丙三种抄本，是现存最早的《仪礼》写本，对校勘今本《仪礼》价值极高。\n\n【《仪礼·士相见礼》（甲本）代表段落】\n士相见之礼。挚，冬用雉，夏用腒。左头奉之，曰：“某也愿见，无由达。某子以命命某见。”主人对曰：“某子以命命某见，吾子有辱。请吾子之就家也，某将走见。”宾对曰：“不足以辱命，请终赐见。”主人对曰：“某非敢为仪，请吾子之就家也，某将走见。”宾对曰：“某非敢为仪，固以请。”主人对曰：“某固辞，不得命，将走见。闻吾子称挚，敢辞挚。”宾对曰：“某不以挚，不敢见。”主人对曰：“某不足以习礼，敢固辞。”宾对曰：“某不依于挚，不敢见，固以请。”主人对曰：“某固辞，不得命，敢不从！”出迎，再拜。宾答拜。主人揖，入门右。宾奉挚，入门左。主人拜受，宾拜送挚，出。",
  "translation": "【《仪礼·士相见礼》译文】\n士与士相见的礼仪。见面礼物，冬天用野鸡，夏天用风干的野鸡肉。左手捧着礼物，说：“某人愿意拜见，但没有门路通达。某人根据您的指示命我来见您。”主人回答说：“某人根据您的指示命您来见，又劳您亲自前来。请先回家，我当急往拜见。”宾客回答说：“不值得让您如此费心，请务必赐见。”主人回答说：“我不敢讲究虚礼，请先回家，我当急往拜见。”宾客回答说：“我不敢讲究虚礼，坚持请求。”主人回答说：“我坚辞未获允许，将急往拜见。听说您带来了礼物，我怎敢接受礼物。”宾客回答说：“我不带礼物，不敢来见。”主人回答说：“我不值得您如此习礼，斗胆坚辞。”宾客回答说：“我不凭借礼物，不敢来见，坚持请求。”主人回答说：“我坚辞不获允许，怎敢不从命！”出门迎接，再拜。宾客答拜。主人作揖，入门右。宾客捧着礼物，入门左。主人拜受礼物，宾客拜送礼物，出去。",
  "note": "1959年甘肃武威磨咀子汉墓出土，共约480枚。最重要的内容是九篇《仪礼》，分甲、乙、丙三种抄本，是现存最早的《仪礼》写本。甲本为木简字大简宽，存《士相见》《服传》《特牲》《少牢》《有司》《燕礼》《泰射》七篇；乙本木简字小，仅存《服传》；丙本竹简，仅存《丧服》。此外还有王杖诏书令、日忌杂占等。字体为成熟汉隶，被称为“武威汉隶”。藏于甘肃省博物馆。",
  "baike_query": "武威汉简",
  "raw_type": "简牍",
  "raw_date": "西汉（约西汉晚期）"
}
