{
  "name": "致通判帖",
  "dynasty": "宋遼金",
  "author": "米芾",
  "year": -1,
  "calligraphy_type": "行書",
  "source": "Marvis 碑帖释文数据集（第 48 批）",
  "editor": "marvis-import",
  "release_date": "2024-12-01",
  "description": "类型：墨迹（尺牍）。年代：宋。米芾尺牍。此类致友人的短札因文字过于简洁，历代释读争议较大。",
  "content": "米芾致通判朝议：分别一夜，问候安好。送上薄物，烦请收纳。礼轻意薄，惭愧惶恐。",
  "original_text": "芾顿首启。经宿。尊候冲胜。山试纳文府。轻鲜。愧悚。芾顿首。通判朝议台坐。",
  "translation": "米芾致通判朝议：分别一夜，问候安好。送上薄物，烦请收纳。礼轻意薄，惭愧惶恐。",
  "note": "米芾尺牍。此类致友人的短札因文字过于简洁，历代释读争议较大。",
  "baike_query": "",
  "raw_type": "墨迹（尺牍）",
  "raw_date": "宋"
}
