{
  "name": "兰亭序（定武本）",
  "dynasty": "魏晉南北朝",
  "author": "王羲之",
  "year": 353,
  "calligraphy_type": "其他",
  "source": "Marvis per_stele 数据集 (id=77)",
  "editor": "marvis-import-v2",
  "release_date": "2024-12-01",
  "description": "类型：行书法帖（摹本/刻本）。原始朝代：东晋。作者：王羲之。原文为东晋永和九年（353年）王羲之撰文并书，共28行324字，被誉为'天下第一行书'。真迹已陪葬唐太宗昭陵，传世均为摹本或刻本。相传为欧阳询据王羲之真迹临摹上石，因石刻在北宋定武（今河北定州）发现而得名。为最早的兰亭石刻本，以骨力劲健著称，宋代以来备受推崇。原石早佚，仅以拓本传世。",
  "content": "永和九年，岁在癸丑，暮春之初，我们在会稽郡山阴县的兰亭集会，举行修禊活动。众多贤才都到了，年少的年长的都聚集在一起。这里有高峻的山岭，茂密的树林，修长的竹子，还有清澈的湍急溪流，映衬环绕在左右，我们引溪水为流觞的曲水，依次坐在水边。虽然没有弦乐管乐齐鸣的盛况，但饮酒一杯、赋诗一首，也足以畅快地抒发幽雅的情怀。\n\n这一天，天气晴朗，空气清新，和风温暖舒畅。抬头仰望宇宙的广阔，低头俯察万物的繁盛，这样纵目观览、驰骋胸怀，足以极尽视听的欢娱，实在令人快乐啊。\n\n人与人相处，俯仰之间便是一生。有人与朋友在一室之内畅谈抱负；有人将情怀寄托于所好之事，放纵形骸之外。虽然取舍千差万别，性情有安静与躁动之分，但当他们遇到欣喜的事物，暂时得到满足时，便高兴得忘乎所以，连衰老将要到来都不知道。等到对追求的事物感到厌倦，心情随境遇而改变，感慨便随之而来了。先前所喜爱的，转眼之间已成陈迹，尚且不能不因此而生感慨。何况寿命长短任凭造化，终究要归于终结。古人说：\"死生也是人生大事啊。\"岂不令人悲痛！\n\n每当我看到古人产生感慨的缘由，如同符契相合，没有一次不面对文章叹息悲伤，却无法在心中释怀。我由此深知把生死等同看待是虚妄荒诞的，把长寿的彭祖和夭折的殇子等同看待也是错误的。后人看今天，也如同今天的人看往昔。可悲啊！所以逐一记下当时与会之人，记录他们所写的诗篇，虽然时代不同、世事变迁，但引发感触的情致是一致的。后世阅读这些诗篇的人，也将会为这篇文章而感慨吧。",
  "original_text": "永和九年，岁在癸丑，暮春之初，会于会稽山阴之兰亭，修禊事也。群贤毕至，少长咸集。此地有崇山峻岭，茂林修竹，又有清流激湍，映带左右，引以为流觞曲水，列坐其次。虽无丝竹管弦之盛，一觞一咏，亦足以畅叙幽情。\n\n是日也，天朗气清，惠风和畅。仰观宇宙之大，俯察品类之盛，所以游目骋怀，足以极视听之娱，信可乐也。\n\n夫人之相与，俯仰一世。或取诸怀抱，悟言一室之内；或因寄所托，放浪形骸之外。虽趣舍万殊，静躁不同，当其欣于所遇，暂得于己，快然自足，不知老之将至。及其所之既倦，情随事迁，感慨系之矣。向之所欣，俯仰之间，已为陈迹，犹不能不以之兴怀。况修短随化，终期于尽。古人云：\"死生亦大矣。\"岂不痛哉！\n\n每览昔人兴感之由，若合一契，未尝不临文嗟悼，不能喻之于怀。固知一死生为虚诞，齐彭殇为妄作。后之视今，亦犹今之视昔。悲夫！故列叙时人，录其所述，虽世殊事异，所以兴怀，其致一也。后之览者，亦将有感于斯文。",
  "translation": "永和九年，岁在癸丑，暮春之初，我们在会稽郡山阴县的兰亭集会，举行修禊活动。众多贤才都到了，年少的年长的都聚集在一起。这里有高峻的山岭，茂密的树林，修长的竹子，还有清澈的湍急溪流，映衬环绕在左右，我们引溪水为流觞的曲水，依次坐在水边。虽然没有弦乐管乐齐鸣的盛况，但饮酒一杯、赋诗一首，也足以畅快地抒发幽雅的情怀。\n\n这一天，天气晴朗，空气清新，和风温暖舒畅。抬头仰望宇宙的广阔，低头俯察万物的繁盛，这样纵目观览、驰骋胸怀，足以极尽视听的欢娱，实在令人快乐啊。\n\n人与人相处，俯仰之间便是一生。有人与朋友在一室之内畅谈抱负；有人将情怀寄托于所好之事，放纵形骸之外。虽然取舍千差万别，性情有安静与躁动之分，但当他们遇到欣喜的事物，暂时得到满足时，便高兴得忘乎所以，连衰老将要到来都不知道。等到对追求的事物感到厌倦，心情随境遇而改变，感慨便随之而来了。先前所喜爱的，转眼之间已成陈迹，尚且不能不因此而生感慨。何况寿命长短任凭造化，终究要归于终结。古人说：\"死生也是人生大事啊。\"岂不令人悲痛！\n\n每当我看到古人产生感慨的缘由，如同符契相合，没有一次不面对文章叹息悲伤，却无法在心中释怀。我由此深知把生死等同看待是虚妄荒诞的，把长寿的彭祖和夭折的殇子等同看待也是错误的。后人看今天，也如同今天的人看往昔。可悲啊！所以逐一记下当时与会之人，记录他们所写的诗篇，虽然时代不同、世事变迁，但引发感触的情致是一致的。后世阅读这些诗篇的人，也将会为这篇文章而感慨吧。",
  "note": "原文为东晋永和九年（353年）王羲之撰文并书，共28行324字，被誉为'天下第一行书'。真迹已陪葬唐太宗昭陵，传世均为摹本或刻本。相传为欧阳询据王羲之真迹临摹上石，因石刻在北宋定武（今河北定州）发现而得名。为最早的兰亭石刻本，以骨力劲健著称，宋代以来备受推崇。原石早佚，仅以拓本传世。",
  "raw_type": "行书法帖（摹本/刻本）",
  "raw_dynasty": "东晋",
  "marvis_id": 77
}
