{
  "name": "元桢墓志",
  "dynasty": "魏晉南北朝",
  "author": "佚名",
  "year": 496,
  "calligraphy_type": "楷書",
  "source": "Marvis 碑帖释文数据集（第 16 批）",
  "editor": "marvis-import",
  "release_date": "2024-12-01",
  "description": "类型：墓志（石质）。年代：太和二十年(496年)。全称《魏使持节镇北大将军相州刺史南安王元桢墓志铭》，刻于北魏太和二十年（496年）。1926年（一说1922年）在洛阳城北邙山出土，现藏西安碑林。元桢为景穆皇帝之孙，南安惠王第二子，封南安王，官至使持节镇北大将军、相州刺史。此志是现存元氏墓志中年代最早者之一（仅晚于《元简墓志》），书法尚存隶意，结字方整宽博，用笔雄强有力，是北魏早期墓志的代表。",
  "content": "魏使持节镇北大将军相州刺史南安王元桢墓志铭\n\n王名桢，字某，河南洛阳人。恭宗景穆皇帝的孙子，南安惠王的次子。……\n\n太和二十年（496年）岁次丙子八月壬辰朔二日癸巳，在邺城去世。……\n\n……于是于当年十一月庚申朔二十六日乙酉，安葬于邙山。……\n\n于是作铭辞：……",
  "original_text": "魏使持节镇北大将军相州刺史南安王元桢墓志铭\n\n王讳桢，字□□，河南洛阳人也。恭宗景穆皇帝之孙，南安惠王之第二子。……\n\n太和廿年岁次丙子八月壬辰朔二日癸巳，薨于邺。……\n\n……粤以其年十一月庚申朔廿六日乙酉，窆于芒山。……\n\n乃作铭曰：\n……",
  "translation": "魏使持节镇北大将军相州刺史南安王元桢墓志铭\n\n王名桢，字某，河南洛阳人。恭宗景穆皇帝的孙子，南安惠王的次子。……\n\n太和二十年（496年）岁次丙子八月壬辰朔二日癸巳，在邺城去世。……\n\n……于是于当年十一月庚申朔二十六日乙酉，安葬于邙山。……\n\n于是作铭辞：……",
  "note": "全称《魏使持节镇北大将军相州刺史南安王元桢墓志铭》，刻于北魏太和二十年（496年）。1926年（一说1922年）在洛阳城北邙山出土，现藏西安碑林。元桢为景穆皇帝之孙，南安惠王第二子，封南安王，官至使持节镇北大将军、相州刺史。此志是现存元氏墓志中年代最早者之一（仅晚于《元简墓志》），书法尚存隶意，结字方整宽博，用笔雄强有力，是北魏早期墓志的代表。",
  "baike_query": "",
  "raw_type": "墓志（石质）",
  "raw_date": "太和二十年(496年)"
}
