{
  "name": "频有哀祸帖",
  "dynasty": "魏晉南北朝",
  "author": "王羲之",
  "year": -1,
  "calligraphy_type": "其他",
  "source": "Marvis per_stele 数据集 (id=99)",
  "editor": "marvis-import-v2",
  "release_date": "2024-12-01",
  "description": "类型：行草尺牍（唐摹本）。原始朝代：东晋。作者：王羲之。行草书，纵24.8cm，3行20字。唐摹本，硬黄纸本双钩廓填。与《孔侍中帖》《忧悬帖》三帖合装于一纸，总称《孔侍中帖》或《九月十七日帖》，纵24.8cm横41.8cm。画心中央纸缝处钤有'延历敕定'朱文印记三方，现藏日本前田育德会。经数字全息透视检测发现此帖很可能是王羲之手迹而非双钩填墨，极为珍贵。作品行轴线时曲时直、书体时草时行、点画时方时圆，书写风格沉雄跳宕、劲健流纵。",
  "content": "频频有哀祸的事情发生，悲痛如刀一般切割内心，无法克制自己，怎么办啊，我已无可奈何。即使得到安慰，也仍会倍加感伤。",
  "original_text": "频有哀祸，悲摧切割，不能自胜，奈何奈何！省慰增感。",
  "translation": "频频有哀祸的事情发生，悲痛如刀一般切割内心，无法克制自己，怎么办啊，我已无可奈何。即使得到安慰，也仍会倍加感伤。",
  "note": "行草书，纵24.8cm，3行20字。唐摹本，硬黄纸本双钩廓填。与《孔侍中帖》《忧悬帖》三帖合装于一纸，总称《孔侍中帖》或《九月十七日帖》，纵24.8cm横41.8cm。画心中央纸缝处钤有'延历敕定'朱文印记三方，现藏日本前田育德会。经数字全息透视检测发现此帖很可能是王羲之手迹而非双钩填墨，极为珍贵。作品行轴线时曲时直、书体时草时行、点画时方时圆，书写风格沉雄跳宕、劲健流纵。",
  "raw_type": "行草尺牍（唐摹本）",
  "raw_dynasty": "东晋",
  "marvis_id": 99
}
