{
  "name": "刘平国治关颂",
  "dynasty": "秦漢",
  "author": "佚名",
  "year": 158,
  "calligraphy_type": "其他",
  "source": "Marvis per_stele 数据集 (id=38)",
  "editor": "marvis-import-v2",
  "release_date": "2024-12-01",
  "description": "类型：摩崖刻石。原始朝代：东汉。作者：佚名。全称《龟兹左将军刘平国治关亭摩崖》，东汉永寿四年（158年）刻于新疆拜城黑英山乡博孜克日格沟口崖壁，被誉为大汉西域第一石刻。记龟兹左将军刘平国率六人在天山通道凿关建城之事，是汉代维护丝绸之路畅通的重要实证。",
  "content": "龟兹左将军刘平国，于七月二十六日率众出发，带领来自秦地的孟伯山、狄虎贲、赵当卑、夏羌、石当卑、程阿羌等六人，一起来此修建列亭，从谷关开始。八月一日起开凿山石凿孔，到十日完工。祝愿坚固万岁人民欢喜，长寿亿年福及子孙。永寿四年（158年）八月十二日乙酉日吉时建此纪念。东边的乌累关城都是将军所建。\n京兆长安人淳于伯隗作此诵文。",
  "original_text": "龟兹左将军刘平国，以七月廿六日发家，从秦人孟伯山、狄虎贲、赵当卑、夏羌、石当卑、程阿羌等六人，共来作列亭，从谷关。八月一日始斫山石作孔，至十日止。坚固万岁人民喜，长寿亿年宜子孙。永寿四年八月甲戌朔，十二日乙酉直建纪。此东乌累关城，皆将军所作也。佐掖。\n京兆长安 淳于伯隗 作此诵。",
  "translation": "龟兹左将军刘平国，于七月二十六日率众出发，带领来自秦地的孟伯山、狄虎贲、赵当卑、夏羌、石当卑、程阿羌等六人，一起来此修建列亭，从谷关开始。八月一日起开凿山石凿孔，到十日完工。祝愿坚固万岁人民欢喜，长寿亿年福及子孙。永寿四年（158年）八月十二日乙酉日吉时建此纪念。东边的乌累关城都是将军所建。\n京兆长安人淳于伯隗作此诵文。",
  "note": "全称《龟兹左将军刘平国治关亭摩崖》，东汉永寿四年（158年）刻于新疆拜城黑英山乡博孜克日格沟口崖壁，被誉为大汉西域第一石刻。记龟兹左将军刘平国率六人在天山通道凿关建城之事，是汉代维护丝绸之路畅通的重要实证。",
  "raw_type": "摩崖刻石",
  "raw_dynasty": "东汉",
  "marvis_id": 38
}
