{
  "name": "颜氏家庙碑",
  "dynasty": "隋唐五代",
  "author": "颜真卿",
  "year": 780,
  "calligraphy_type": "其他",
  "source": "Marvis per_stele 数据集 (id=211)",
  "editor": "marvis-import-v2",
  "release_date": "2024-12-01",
  "description": "类型：碑刻（家庙碑）。原始朝代：唐。作者：颜真卿。全称《唐故通议大夫行薛王友柱国赠秘书少监国子祭酒太子少保颜君庙碑铭并序》，刻于建中元年（780年），颜真卿七十二岁。为其父颜惟贞建立家庙所立之碑，详述颜氏世系。此碑是颜真卿晚年最成熟的作品之一，也是他存世最晚的碑刻。用笔已臻化境，雄浑苍劲，是\"人书俱老\"的最高境界。碑高3.38m，四面刻字，气势雄伟。现存西安碑林。\n[补全全文·fulltext_tangA] 据《全唐文》卷三四〇，虚阁网 xuges.com 核对（颜真卿撰文并书）",
  "content": "唐故通议大夫行薛王友柱国赠秘书少监国子祭酒太子少保颜君庙碑铭并序。颜真卿为其父颜惟贞及颜氏家族立庙立碑，追溯颜氏家族从殷商到唐代的世代渊源。原碑有残损，此据传世文本录文。",
  "original_text": "唐故通议大夫行薛王友柱国赠秘书少监国子祭酒太子少保颜君碑铭\n\n\r\n昔孔悝有彝鼎之铭，陆机有祠堂之颂，皆所以发挥祖德，敷演家声。故君子之观其铭也，既美其所称，又美其所为。无而称之，是诬也；有而不述，岂仁乎？论而撰之，敢不祗惧！君讳惟贞，字叔坚。其先出於颛顼之孙祝融，融孙安为曹姓。其裔邾武公，名夷甫，字颜。子友，别封郳为小邾子，遂以颜为氏，多仁鲁为卿大夫。孔门达者七十二人，颜氏有八。战国有率、烛，秦有芝、贞，汉有异、肆、安、乐。其后丧乱，谱牒沦亡。魏有裴、盛，盛字叔台，青、徐二州刺史、关内侯，始自鲁居於琅琊临沂孝悌里。生广陵太守、给事中、葛绎贞子讳钦，字公若，精《韩诗》、《礼》、《易》、《尚书》，学者宗之。生汝阴太守、护军、袭葛绎子讳默，字静伯。生晋侍中、光禄大夫、西平靖侯讳含，字宠都。随元帝过江，已下七叶，葬在上元幕府山西。生侍中、光禄勋、西平定侯讳髦，字君道，事具《孝行传》。生州西曹骑都尉、西平侯讳綝，字文和。生宣城太守、御史中丞讳靖之，字茂宗。生巴陵太守、度支校尉讳腾之，字宏道，善草隶书，有风格。梁武帝《草书评》云：“颜腾之、贺道力并便尺牍，少行於代。”生辅国江夏王参军讳炳之，字叔豹，以能书称。生齐持书御史兼中丞讳见远，字见远。和帝被弑，一恸而绝，梁武深恨之，事见《梁》、《周》、《北齐书》。生梁镇西记室参军讳协，字子和，感家门事，义不求闻达，元帝著《怀旧诗》以伤之。撰《晋仙传》五篇、《日月灾异图》两卷，文集二十卷，见《梁书》。生北齐给事、黄门侍郎、待诏文林馆、平原太守、隋东宫学士讳之推，字介，著《家训》二十篇、《冤魂志》三卷、《证俗字音》五卷，文集三十卷，事具本传。黄门兄之仪，周御正、御史、中大夫、麟趾学士。隋文辅政，不署矫诏，索玺又拒之，出为集州刺史、新野公。后朝朔望，引之御榻曰：“见危授命，临大节而不可夺，古人所重，何以加卿？”事具《周书》。弟之善，隋叶令，子孙见於后。黄门生皇秦王记室讳思鲁，愍楚、游秦小。记室字孔归，君之曾祖也。隋司经校书、东宫学士，率子弟奉迎义旗於长春宫，招瓜州，拜仪同。博学善属文，自为父集序。《国史》称温大雅在隋，与思鲁同事东宫，彦博与愍楚同直内史省，彦将时与游秦同典校秘阁。二家兄弟，各为一时人物之选。少时学业，颜氏为优，其后职位，温氏为盛。《温氏谱》亦载焉。生勤礼，字敬，君之祖也。幼而朗悟，识量宏远，工於篆籀，尤精诂训。解褐校书郎，与两兄弟师古、相时同时为宏文崇贤学士，弟育德又於司经校定经史，当代荣之。太宗尝令师古赞崇贤学士，以兄弟，特命萧钧赞之曰：“依仁服义，怀文守一。履道自居，下帷终日。德彰素里，行成兰室。鹤钥驰誉，龙楼委质。”著作郎、修国史、夔府长史，赠虢州刺史。生昭甫、敬仲、殆庶、无恤、少连、务滋、辟强。昭甫字周卿，君之父也。幼而颖悟，尤明诂训，工篆籀草隶书，与内弟殷仲容齐名，而劲利过之，特为伯父师古所赏重，每有著述，必令参定。尝得古鼎二十馀字，举朝莫识，尽能读之。高宗侍读、曹王属，赠华州刺史。真卿表谢，肃宗批答：“卿之乃祖，当为硕儒，既高倚相之能，遂有臧孙之后。不坠其业，在卿之门。”生我伯父讳元孙臮君。伯父聪颖绝伦，尤工文翰。举进士，考功郎刘奇特标榜之，由是名动海内。累迁太子舍人。元宗监国，专掌令画。尝和《游苑诗》，批云：“孔门称哲，宋室闻贤。翰墨云捷，莫之与先。”历滁、沂、濠三州刺史，赠秘书监。君仁孝友悌，少孤，育舅殷仲容氏，蒙教笔法。家贫无纸笔，与兄以黄土扫壁本石画而习之，故特以草隶擅名。天授元年，糊名考试，判入高等。以亲累授衢州参军，与盈川令杨炯、信安尉桓彦范相得甚欢。又选授洛州温县、永昌二尉，每选皆判入高科。侍郎苏味道以所试示介众曰：“选人中乃有如此书判！”嗟叹久之。遂代兄为长安尉、太子文学，以清白五为察访使魏奉古等所荐。五邸初开，盛选僚属，拜薛王友柱国。伯姊御史大夫张知泰妻鲁郡夫人亡，将葬，数家占君不利临圹。君哭而拒之曰：“岂有亡手足之痛，牵拘忌而忍自绝乎？”弗从。其年七月才生明，遘疾而殁，教义者隐而伤焉。与会稽贺知章、陈郡殷践猷、吴郡陆象先、上谷寇霑、河南源光裕、博陵崔璩友善，事具陆据所撰《神道碑》。累赠秘书少监、国子祭酒、太子少保，真卿表谢。肃宗批答云：“卿之先人，德行优著，学精百氏，艺绝六书。频擢甲科，屡升循政，曳裾王府，名右邹枚。载笔春宫，道高徐阮。既而寿乖华发，器纡青云，业载史臣，庆传令子。追存盛美，褒赠崇班，且旌善於义方，俾扬名於有后。”濠州生春卿、杲卿、曜卿、旭卿、茂曾。春卿工词翰，倜傥有吏才，苏颋举茂才，偃师丞。杲卿文理清峻，所居有声，太常丞、摄常山太守。禄山反，擒其心手，开土门，拜卫尉卿兼中丞。城陷，杲卿叱詈之，遂被钩舌支解而终，赠太子太保，谥曰忠节。真卿表谢，肃宗批答云：“自羯胡猖狂，入我河县，所以官吏，多受迫胁。卿兄以人臣大节，独制横流，或俘其谋主，或斩其元恶。当以救兵悬绝，身陷贼廷，旁若无人，历数其罪。手足寄於锋刃，忠义形於颜色。古所未有，朕甚嘉之。”曜卿工诗书草隶，十五以文学直崇文馆，淄川司马。旭卿善草书，允山令。茂曾好属文诂训，仁厚绝众，犍为司马。君生阙疑、允南、乔卿、真长、幼舆、真卿、允臧。阙疑仁孝有吏能，精《诗传》，善剖判，杭州参军。允南仁孝有清识，工诗，人多诵其佳句，善草隶，与春卿、杲卿、曜卿同日於铨庭为侍郎席建侯所赏，达奚珣荐为左补阙。真卿时为殿中，正至，三拱法座舞蹈，而衣袂相接者三。故允南赋诗云：“谁言百人会，兄弟也霑陪。”历殿中、膳部、司封郎中、国子司业、金乡男。乔卿仁和有吏干，富平尉。真长清直早世。幼舆方雅有酝藉，通《班汉》，左清道率府兵曹。真卿早孤，蒙伯父臮、允南亲自教诲。举进士，历校书；制举，醴泉尉；陟清白，长安尉。三院御史，四为大夫，六为尚书，再为采访节度，充礼仪使光禄大夫，鲁郡公。允臧敦质孝悌，有吏能，制举延昌令，监察、充朔方衣资使、殿中，三为侍御史，中允、江陵少尹、荆南行军。濠州及君孙：泉明，佐父开土门，彭州司马。威明，邛州司马。季明、子干、沛、翊、颇、诞，及外孙博野尉沈盈、卢逖，并为逆胡所害，各蒙赠五品京官。濬，好属文。翘、华、正、颎。慈明，都水使者。颎好五言，校书。颋，仁孝方正，明经，大理司直，岭南营田判官，执丧九日不食。颉，河阳尉。顗，凤翔参军。颇，工小楷，洗马。颃，恭仁，奉礼郎。并早丧逝。绂，方义主簿。臮觏，并没蛮。袭明、微明、德明，未仕。通明，获嘉尉。将明，昌明尉。克明，崇文，明经，卫密标榜之。翙，有德行文词，华原主簿。准，溧水尉。觌，颇工文，襄阳尉。觐，有文行，宏文，进士。颢，仁友清白，常熟令，封金乡男。颖，清介觐学，侍郎蒋冽赏其判，京兆兵曹，袭金乡男。岫，仁纯，常熟主簿、任城男。颀，浚仪尉。颂，清源尉。顶，干办，扬府法曹。愿，长厚清白，朝邑尉。頵，左率仓曹。硕，秘书正字。颒，有吏干，歙州录事参军、曲阜男。頩，好为诗，富阳尉。禺，好为文，常州参军。并粗有所立。君之诸祖父群从、扬庭、颐，并侍读。强学、益期，并学士。中和、至诚、敬仲、大智、温之、澂之、澹之、搢、挺、援、撰、温、泳、陵，并明经。康成、强学、希庄、日损、隐朝、邻几、知微、舒、说、顺、胜、式宣、韶，并进士、制举。有意、中和、趋庭、希庄，至刺史。利仁，明天文。欣期、元淑、景灵，并校书。光庭，注《后汉书》。嘉宾、千里、升庠、匡朝、怡、滔、浑、允济、搢、逸、觌、不器、防，有文词。博古、少连、恭敏、惇学行。敬仲、温之，以孝闻。润，有风义。晃、鏻、邈、迢，以清白称。其馀咸著官族，不获悉数。洪惟累祖之耿光丕业，有若子泉宏都之德行，巴陵记室之书翰，特进黄门之文章，秘监华州之学识。肇自鲁国，格於圣代，纷纶盛美，遂举集於君。君能述遵前人，不敢失坠其志事，以忝聿修，宜其克飨尊荣，为清庙不祧之主。真卿幸承遗训，叨受国恩，既受无疆之庥，敢扬不朽之烈。铭曰：\n\n\r\n系我宗，邾颜公。子封郳，鲁附庸。亚孔圣，浴沂风。刺青徐，给事中。护营柳，渡江枫。侍兄疾，感虬童。邻火断，珥貂重。施七叶，传孝恭。武骑都，尉司从。便尺牍，继鱼虫。恸君难，愤而终。咨记室，游湘东。嗟御正，凛移忠。臮黄门，擅文雄。三韶长，事东宫。四穆叔，史牢笼。褒华州，诂训通。小秘监，盛名鸿。维少保，文翰工。莅畿赤，五裒崇。登望苑，友桂丛。三超赠，保储宫。流光盛，庙貌融。永不祧，垂无穷。",
  "translation": "唐故通议大夫行薛王友柱国赠秘书少监国子祭酒太子少保颜君庙碑铭并序。颜真卿为其父颜惟贞及颜氏家族立庙立碑，追溯颜氏家族从殷商到唐代的世代渊源。原碑有残损，此据传世文本录文。",
  "note": "全称《唐故通议大夫行薛王友柱国赠秘书少监国子祭酒太子少保颜君庙碑铭并序》，刻于建中元年（780年），颜真卿七十二岁。为其父颜惟贞建立家庙所立之碑，详述颜氏世系。此碑是颜真卿晚年最成熟的作品之一，也是他存世最晚的碑刻。用笔已臻化境，雄浑苍劲，是\"人书俱老\"的最高境界。碑高3.38m，四面刻字，气势雄伟。现存西安碑林。\n[补全全文·fulltext_tangA] 据《全唐文》卷三四〇，虚阁网 xuges.com 核对（颜真卿撰文并书）",
  "raw_type": "碑刻（家庙碑）",
  "raw_dynasty": "唐",
  "marvis_id": 211
}
