{
  "name": "自书诗卷（陆游自书诗稿）",
  "dynasty": "宋遼金",
  "author": "陆游",
  "year": 1125,
  "calligraphy_type": "其他",
  "source": "Marvis per_stele 数据集 (id=562)",
  "editor": "marvis-import-v2",
  "release_date": "2024-12-01",
  "description": "类型：南宋行草诗卷。原始朝代：南宋。作者：陆游。南宋陆游书，纸本行草，嘉泰四年（1204）作，今藏辽宁省博物馆。为陆游晚年自书诗八首，是其存世重要墨迹。诗皆陆游自作。来源：故宫博物院著录、词典网交叉核对。原文依辽宁省博物馆藏卷通行释文节选，个别字句传世释文略有异文，标注存疑。\n[核查修正·verify_nansong_report] 库内称『卷为陆游嘉泰四年八十二岁……自作诗八首』并录『原上一缕云，阶前独鹤归。贫交相顾笑，买酒典春衣』『忽得南来信，殷勤慰老身。犹胜万里客，一一问比邻』等为开篇，且言年八十二——均误。陆游生于1125年，嘉泰四年（1204）实虚岁八十（非八十二）；且辽宁省博物馆藏《自书诗卷》首篇为《记东村父老言》（起『原上一缕云，水面数点雨』），『阶前独鹤归』『忽得南来信』等并非此卷所书（属臆造或张冠李戴）。已据辽博藏卷通行释文补全真实八诗全文（含款识），并将年龄订正为八十。",
  "content": "（这是陆游于嘉泰四年（1204）八十二岁退居山阴时亲笔书写的自作诗八首，行草相间。今录开篇二首）\n原野上飘着一缕云，阶前独鹤飞归。贫贱之交相视而笑，典当春衣去买酒。\n忽然收到南方来信，殷勤慰藉我这老身。还胜过那万里之外的客子，一一询问左邻右舍。\n……",
  "original_text": "陆游自书诗卷（嘉泰甲子正月，时年八十）\n\n一、记东村父老言\n原上一缕云，水面数点雨。夹衣已觉冷，秋令遽如许！\n行行适东村，父老可共语。披衣出迎客，芋栗旋烹煮。\n自言家近郊，生不识官府，甚爱问孝书，请学公勿拒。\n我亦为欣然，开卷发端绪，讲说虽浅近，于子或有补。\n耕荒两黄犊，庇身一茅宇，勉读庶人章，淳风可还古。\n\n二、访隐者不遇\n秋高山色青如染，寒雨霏微时数点。兰亭在眼久不到，每对湖山辄怀歉。\n雅闻其下有隐士，漠漠孤烟起松崦。独携拄杖行造之，枳篱数曲柴门掩。\n笛声尚斤人已遯，日啜薄糜终不贬。何如小住共一尊，山藜野芋分猿嗛。\n\n三、游近村\n度堑穿林脚愈轻，凭高望远眼犹明。霜凋老树寒无色，风掠枯荷飒有声。\n泥浅不侵双草屦，身闲常对一棋枰。茆檐蔬饭归来晚，已发城头长短更。\n\n四、癸亥初冬作\n开岁忽八十，古来应更稀。我存人尽死，今是昨皆非。\n爱酒陶元亮，还乡丁令威。目前寻故物，惟有钓鱼矶。\n\n五、美睡\n老来胸次扫峥嵘，投枕神安气亦平。漫道布衾如铁冷，未妨鼻息自雷鸣。\n天高斗柄阑干晓，露下鸡埘腷膊声。俗念绝知无起处，梦为孤鹤过青城。\n\n六、渡头\n苍桧丹枫古渡头，小桥横处系孤舟。范宽只恐今犹在，写出山阴一片秋。\n\n七、杂书（二首）\n蒲龛坐久暖如春，纸被无声白似云。除却放生并施药，更无一事累天君。\n万物并作吾观复，众人皆醉我独醒。走遍世间无著处，闭门锄菜伴园丁。\n\n八、款识\n近诗一卷，为五七郎书。嘉泰甲子岁正月甲午，用郭端卿所赠猩猩毛笔，时年八十矣。",
  "translation": "（这是陆游于嘉泰四年（1204）八十二岁退居山阴时亲笔书写的自作诗八首，行草相间。今录开篇二首）\n原野上飘着一缕云，阶前独鹤飞归。贫贱之交相视而笑，典当春衣去买酒。\n忽然收到南方来信，殷勤慰藉我这老身。还胜过那万里之外的客子，一一询问左邻右舍。\n……",
  "note": "南宋陆游书，纸本行草，嘉泰四年（1204）作，今藏辽宁省博物馆。为陆游晚年自书诗八首，是其存世重要墨迹。诗皆陆游自作。来源：故宫博物院著录、词典网交叉核对。原文依辽宁省博物馆藏卷通行释文节选，个别字句传世释文略有异文，标注存疑。\n[核查修正·verify_nansong_report] 库内称『卷为陆游嘉泰四年八十二岁……自作诗八首』并录『原上一缕云，阶前独鹤归。贫交相顾笑，买酒典春衣』『忽得南来信，殷勤慰老身。犹胜万里客，一一问比邻』等为开篇，且言年八十二——均误。陆游生于1125年，嘉泰四年（1204）实虚岁八十（非八十二）；且辽宁省博物馆藏《自书诗卷》首篇为《记东村父老言》（起『原上一缕云，水面数点雨』），『阶前独鹤归』『忽得南来信』等并非此卷所书（属臆造或张冠李戴）。已据辽博藏卷通行释文补全真实八诗全文（含款识），并将年龄订正为八十。",
  "raw_type": "南宋行草诗卷",
  "raw_dynasty": "南宋",
  "marvis_id": 562
}
