{
  "name": "大克鼎",
  "dynasty": "秦漢",
  "author": "不详",
  "year": 1951,
  "calligraphy_type": "其他",
  "source": "Marvis per_stele 数据集",
  "editor": "marvis-import-v2",
  "release_date": "2024-12-01",
  "description": "类型：金文。原始朝代：西周。铭文290字，西周中期器，光绪年间陕西扶风出土，潘达于1951年捐赠，现藏上海博物馆。",
  "content": "克颂扬其祖父师华父的美德，因其功绩，周王任命克为膳夫，负责出传王命。周王在宗周穆庙册命克，赏赐大量土地（野、渒、康、匽、溥原、寒山等处）和臣妾、史官、乐器等。克感恩铸鼎。",
  "original_text": "克曰：穆穆朕文祖师华父，悤襄厥心，宁静于猷，淑哲厥德。肆克恭保厥辟恭王，谏乂王家，惠于万民。远能迩，肆克□于皇天，琐于上下，得纯亡敃，赐釐无疆，永念于厥孙辟天子。天子明哲，显孝于神，经念厥圣保祖师华父，勠克王服，出纳王令，多赐宝休。丕显天子，天子其万年无疆，保乂周邦，畯尹四方。\n王在宗周，旦，王格穆庙，即位，申季右膳夫克，入门，立中廷，北向，王呼尹氏册命膳夫克。王若曰：克，昔余既命汝出纳朕命，今余唯申就乃命，赐汝叔巿、参冋中悤。赐汝田于野，赐汝田于渒，赐汝井家田于畯，以厥臣妾，赐汝田于康，赐汝田于匽，赐汝田于溥原，赐汝田于寒山，赐汝史小臣、霝、籥、鼓、钟，赐汝井、微、人。赐汝井人奔于粮。敬夙夜用事，勿废朕命。\n克拜稽首，敢对扬天子丕显鲁休，用作朕文祖师华父宝彝，克其万年无疆，子子孙孙永宝用。",
  "translation": "克颂扬其祖父师华父的美德，因其功绩，周王任命克为膳夫，负责出传王命。周王在宗周穆庙册命克，赏赐大量土地（野、渒、康、匽、溥原、寒山等处）和臣妾、史官、乐器等。克感恩铸鼎。",
  "note": "铭文290字，西周中期器，光绪年间陕西扶风出土，潘达于1951年捐赠，现藏上海博物馆。",
  "raw_type": "金文",
  "raw_dynasty": "西周",
  "marvis_id": -1
}
