{
  "name": "集王圣教序",
  "dynasty": "隋唐五代",
  "author": "怀仁集王羲之",
  "year": 672,
  "calligraphy_type": "行書",
  "source": "Marvis 碑帖释文数据集（第 20 批）",
  "editor": "marvis-import",
  "release_date": "2024-12-01",
  "description": "类型：集字碑（序文）。年代：咸亨三年(672年)。全称《大唐三藏圣教序》又名《怀仁集王羲之书圣教序》，刻于唐咸亨三年（672年），现存西安碑林。唐太宗和唐高宗分别为玄奘译经撰写了序文，弘福寺僧怀仁奉敕从内府收藏的王羲之行书真迹中逐字集摹，历时二十四年刻成此碑。共集王字1900余字。此碑保存了唐初尚存的大量王羲之行书真迹面貌，因唐太宗时期王羲之真迹多有流传，所以集字质量极高，被誉为学习王羲之行书的最佳范本。每个字都保持了王羲之书法的神韵，字字珠玑。",
  "content": "（内容为唐太宗所作《大唐三藏圣教序》和唐高宗《述圣记》，怀仁花费二十四年从王羲之行书中集字刻成。）",
  "original_text": "（《集王圣教序》内容为唐太宗《大唐三藏圣教序》和唐高宗《述圣记》，由弘福寺僧怀仁从内府所藏王羲之行书墨迹中逐字集摹，历时二十四年完成。全文约1900余字，嵌于西安碑林。）\n\n……咸亨三年十二月八日京城法侣建立。",
  "translation": "（内容为唐太宗所作《大唐三藏圣教序》和唐高宗《述圣记》，怀仁花费二十四年从王羲之行书中集字刻成。）",
  "note": "全称《大唐三藏圣教序》又名《怀仁集王羲之书圣教序》，刻于唐咸亨三年（672年），现存西安碑林。唐太宗和唐高宗分别为玄奘译经撰写了序文，弘福寺僧怀仁奉敕从内府收藏的王羲之行书真迹中逐字集摹，历时二十四年刻成此碑。共集王字1900余字。此碑保存了唐初尚存的大量王羲之行书真迹面貌，因唐太宗时期王羲之真迹多有流传，所以集字质量极高，被誉为学习王羲之行书的最佳范本。每个字都保持了王羲之书法的神韵，字字珠玑。",
  "baike_query": "",
  "raw_type": "集字碑（序文）",
  "raw_date": "咸亨三年(672年)"
}
