{
  "name": "致司谏帖",
  "dynasty": "宋遼金",
  "author": "米芾",
  "year": -1,
  "calligraphy_type": "其他",
  "source": "Marvis per_stele 数据集 (id=451)",
  "editor": "marvis-import-v2",
  "release_date": "2024-12-01",
  "description": "类型：墨迹（尺牍）。原始朝代：北宋。作者：米芾。米芾尺牍。此类致友人的短札因文字过于简洁，历代释读争议较大。",
  "content": "[真实性待考] 此帖名在公开权威来源（百度百科、书法字典网、故宫博物院等）中无法查证，无可靠释文来源。需权威文献核实后方可恢复。",
  "original_text": "",
  "translation": "[真实性待考] 此帖名在公开权威来源（百度百科、书法字典网、故宫博物院等）中无法查证，无可靠释文来源。需权威文献核实后方可恢复。",
  "note": "米芾尺牍。此类致友人的短札因文字过于简洁，历代释读争议较大。",
  "raw_type": "墨迹（尺牍）",
  "raw_dynasty": "北宋",
  "marvis_id": 451
}
