{
  "name": "高树造像记",
  "dynasty": "魏晉南北朝",
  "author": "佚名",
  "year": 502,
  "calligraphy_type": "其他",
  "source": "Marvis per_stele 数据集 (id=139)",
  "editor": "marvis-import-v2",
  "release_date": "2024-12-01",
  "description": "类型：造像记（龙门二十品）。原始朝代：北魏。作者：佚名。全称《邑主高树等三十二人造像记》，刻于北魏景明三年（502年）。龙门二十品之一，位于洛阳龙门石窟古阳洞北壁。邑主高树为民间佛教结社（邑义）的领袖，带领邑子三十二人集资造像。此记反映了北魏民间佛教结社造像的普遍风气。书法方峻凝重，结字紧密，用笔浑厚有力。解伯都与第128号《解伯达造像记》应为同族。",
  "content": "景明三年（502年）五月三十日，邑主高树、解伯都等三十二人，造石像一区。上为皇帝陛下祈福，下为七世父母祈福。祈愿国运永远兴隆，佛、法、僧三宝绵延显赫。\n\n愿诸位同修者（邑子），道心日益增长，法身圆满具足。居家眷属，福庆日益臻至。",
  "original_text": "景明三年五月卅日，邑主高树、解伯都等卅二人等，造石像一区。上为皇帝陛下，下为七世父母。愿国祚永隆，三宝绵显。\n\n愿诸邑子，道心日增，法身具足。居家眷属，福庆日臻。\n\n（题名略）",
  "translation": "景明三年（502年）五月三十日，邑主高树、解伯都等三十二人，造石像一区。上为皇帝陛下祈福，下为七世父母祈福。祈愿国运永远兴隆，佛、法、僧三宝绵延显赫。\n\n愿诸位同修者（邑子），道心日益增长，法身圆满具足。居家眷属，福庆日益臻至。",
  "note": "全称《邑主高树等三十二人造像记》，刻于北魏景明三年（502年）。龙门二十品之一，位于洛阳龙门石窟古阳洞北壁。邑主高树为民间佛教结社（邑义）的领袖，带领邑子三十二人集资造像。此记反映了北魏民间佛教结社造像的普遍风气。书法方峻凝重，结字紧密，用笔浑厚有力。解伯都与第128号《解伯达造像记》应为同族。",
  "raw_type": "造像记（龙门二十品）",
  "raw_dynasty": "北魏",
  "marvis_id": 139
}
