{
  "name": "元怿墓志",
  "dynasty": "魏晉南北朝",
  "author": "佚名",
  "year": 525,
  "calligraphy_type": "楷書",
  "source": "Marvis 碑帖释文数据集（第 16 批）",
  "editor": "marvis-import",
  "release_date": "2024-12-01",
  "description": "类型：墓志（石质）。年代：孝昌元年(525年)。全称《魏故侍中骠骑大将军仪同三司尚书令都督冀定瀛殷诸军事冀州刺史太保清河文献王元怿墓志铭》，刻于北魏孝昌元年（525年）。元怿字宣仁，孝文帝第五子，封清河王。公元520年元叉发动政变、幽禁灵太后，元怿被元叉所杀，年仅三十四岁。此志书法端丽精整，是元氏墓志中官职衔最长、规格最高者之一。在北魏晚期墓志中极为著名。",
  "content": "魏故侍中骠骑大将军仪同三司尚书令都督冀定瀛殷诸军事冀州刺史太保清河文献王元怿墓志铭\n\n王名怿字宣仁，河南洛阳人。高祖孝文皇帝的第五子，宣武皇帝的弟弟，孝明皇帝的叔叔。\n\n……孝昌元年（525年）十月某日去世，享年三十四岁。\n\n……于是作铭辞：……",
  "original_text": "魏故侍中骠骑大将军仪同三司尚书令都督冀定瀛殷诸军事冀州刺史太保清河文献王元怿墓志铭\n\n王讳怿，字宣仁，河南洛阳人也。高祖孝文皇帝之第五子，宣武皇帝之弟，孝明皇帝之叔。\n\n……孝昌元年十月□□□日薨，春秋卅有四。\n\n……乃作铭曰：\n……",
  "translation": "魏故侍中骠骑大将军仪同三司尚书令都督冀定瀛殷诸军事冀州刺史太保清河文献王元怿墓志铭\n\n王名怿字宣仁，河南洛阳人。高祖孝文皇帝的第五子，宣武皇帝的弟弟，孝明皇帝的叔叔。\n\n……孝昌元年（525年）十月某日去世，享年三十四岁。\n\n……于是作铭辞：……",
  "note": "全称《魏故侍中骠骑大将军仪同三司尚书令都督冀定瀛殷诸军事冀州刺史太保清河文献王元怿墓志铭》，刻于北魏孝昌元年（525年）。元怿字宣仁，孝文帝第五子，封清河王。公元520年元叉发动政变、幽禁灵太后，元怿被元叉所杀，年仅三十四岁。此志书法端丽精整，是元氏墓志中官职衔最长、规格最高者之一。在北魏晚期墓志中极为著名。",
  "baike_query": "",
  "raw_type": "墓志（石质）",
  "raw_date": "孝昌元年(525年)"
}
