{
  "name": "藏真帖",
  "dynasty": "隋唐五代",
  "author": "怀素",
  "year": -1,
  "calligraphy_type": "草書",
  "source": "Marvis 碑帖释文数据集（第 24 批）",
  "editor": "marvis-import",
  "release_date": "2024-12-01",
  "description": "类型：刻帖。年代：唐（约8世纪）。怀素草书自述帖，内容为怀素自述籍贯和学书经历。刻入历代丛帖，是怀素书法的传世名作之一。",
  "content": "怀素字藏真，生于零陵……",
  "original_text": "怀素字藏真，生于零陵……",
  "translation": "怀素字藏真，生于零陵……",
  "note": "怀素草书自述帖，内容为怀素自述籍贯和学书经历。刻入历代丛帖，是怀素书法的传世名作之一。",
  "baike_query": "",
  "raw_type": "刻帖",
  "raw_date": "唐（约8世纪）"
}
