{
  "name": "吾友帖",
  "dynasty": "宋遼金",
  "author": "米芾",
  "year": -1,
  "calligraphy_type": "其他",
  "source": "Marvis per_stele 数据集 (id=397)",
  "editor": "marvis-import-v2",
  "release_date": "2024-12-01",
  "description": "类型：墨迹（尺牍）。原始朝代：北宋。作者：米芾。草书九帖之四。简洁尺牍，草书流畅。\n[核查修正·verify_beisong_mi1_report] 本地原文'吾友何如？数日前见故人……芾贫知交多绝'系错置（疑与他帖混淆），真实《吾友帖》为论草书之帖。原文、译文均错，已补全并改正。",
  "content": "米芾《吾友帖》（草书九帖之四）：与友人论草书，劝其改习草体以追古人，评蔡君谟脚手、索靖真迹、《月仪》'无晋人古气'等。原译文称'邀请友人、借到旦极寒帖已派人送去'与帖文（论草书）完全不符。",
  "original_text": "吾友何不易草体？想便到古人也。盖其体已近古，但少为蔡君谟脚手尔！余无可道也，以稍用意。若得大年《千文》，必能顿长，爱其有偏倒之势，出二王外也。又无索靖真迹，看其下笔处。《月仪》不能佳，恐他人为之，只唐人尔，无晋人古气。",
  "translation": "米芾《吾友帖》（草书九帖之四）：与友人论草书，劝其改习草体以追古人，评蔡君谟脚手、索靖真迹、《月仪》'无晋人古气'等。原译文称'邀请友人、借到旦极寒帖已派人送去'与帖文（论草书）完全不符。",
  "note": "草书九帖之四。简洁尺牍，草书流畅。\n[核查修正·verify_beisong_mi1_report] 本地原文'吾友何如？数日前见故人……芾贫知交多绝'系错置（疑与他帖混淆），真实《吾友帖》为论草书之帖。原文、译文均错，已补全并改正。",
  "raw_type": "墨迹（尺牍）",
  "raw_dynasty": "北宋",
  "marvis_id": 397
}
