{
  "name": "拟山园帖",
  "dynasty": "元明清",
  "author": "王铎",
  "year": -1,
  "calligraphy_type": "其他",
  "source": "Marvis 碑帖释文数据集（第 35 批）",
  "editor": "marvis-import",
  "release_date": "2024-12-01",
  "description": "类型：刻帖（个人丛帖）。年代：清（约17世纪）。王铎个人丛帖，共十卷，由其子王无咎编辑摹刻。\"拟山园\"是王铎的斋号。此帖全面展示了王铎各体书法的成就，尤其是其行草书的面貌，对后世影响极大。清代及近现代学王铎者多从此帖入手。",
  "content": "（王铎个人丛帖《拟山园帖》，收录其各体书法精品。）",
  "original_text": "（此为丛帖汇编，收录历代法书数百件，无法逐一录文。）",
  "translation": "（王铎个人丛帖《拟山园帖》，收录其各体书法精品。）",
  "note": "王铎个人丛帖，共十卷，由其子王无咎编辑摹刻。\"拟山园\"是王铎的斋号。此帖全面展示了王铎各体书法的成就，尤其是其行草书的面貌，对后世影响极大。清代及近现代学王铎者多从此帖入手。",
  "baike_query": "",
  "raw_type": "刻帖（个人丛帖）",
  "raw_date": "清（约17世纪）"
}
